title,link,source,topic
Sri Mulyani Buka Beasiswa LPDP untuk 3256 Mahasiswa ,https://www.realita.co/baca-12808-sri-mulyani-buka-beasiswa-lpdp-untuk-3256-mahasiswa,Realita.co,Pendidikan
Pesan Sri Mulyani Penerima Beasiswa LPDP Jangan Lupa Pulang ,https://www.cnbcindonesia.com/news/20221006074710-4-377589/pesan-sri-mulyani-penerima-beasiswa-lpdp-jangan-lupa-pulang,CNBC Indonesia,Pendidikan
Kementerian PUPR ,https://pu.go.id/berita/BPSDM-Selenggarakan-Bimbingan-Wawancara-Sharing-Session-Program-Beasiswa-LPDP,Kementerian PUPR,Pendidikan
Syarat Skor TOEFL dan IELTS untuk Daftar Beasiswa LPDP 2023 Siap,https://www.kompas.com/edu/read/2022/10/06/071559871/syarat-skor-toefl-dan-ielts-untuk-daftar-beasiswa-lpdp-2023-siap-siap?page=all,Kompas.com - KOMPAS.com,Pendidikan
Pengumuman Beasiswa LPDP Kemenag 2022 dan Jadwal Tahapan Selanjutnya ,https://www.kompas.com/edu/read/2022/10/01/152017871/pengumuman-beasiswa-lpdp-kemenag-2022-dan-jadwal-tahapan-selanjutnya?page=all,Kompas.com - KOMPAS.com,Pendidikan
Didukung Kemdikbudristek LPDP Sediakan Beasiswa S1 Luar Negeri ,"https://www.balipost.com/news/2022/10/12/297720/Didukung-Kemdikbudristek,LPDP-Sediakan-Beasiswa...html",BALIPOST.com,Pendidikan
Inggris Krisis WNI Penerima Beasiswa Minta Dana Tambahan ke LPDP ,https://www.cnnindonesia.com/internasional/20220928183658-134-853909/inggris-krisis-wni-penerima-beasiswa-minta-dana-tambahan-ke-lpdp,CNN Indonesia,Pendidikan
Mau Kuliah di Luar  Dalam Negeri Gratis Ikut Beasiswa LPDP Aja ,https://www.detik.com/edu/beasiswa/d-6319160/mau-kuliah-di-luar--dalam-negeri-gratis-ikut-beasiswa-lpdp-aja,detikcom,Pendidikan
Kisah Penyandang Disabilitas Awardee LPDP Jadi Lulusan S2 Tercepat ,https://www.kompas.com/edu/read/2022/10/05/142710471/kisah-penyandang-disabilitas-awardee-lpdp-jadi-lulusan-s2-tercepat?page=all,Kompas.com - KOMPAS.com,Pendidikan
Syarat Beasiswa LPDP 2022 Reguler bagi Lulusan D4 S1 dan S2 ,https://era.id/afair/104413/syarat-beasiswa-lpdp-2022-reguler-bagi-lulusan-d4-s1-dan-s2,Era.ID,Pendidikan
Di Mana Alumni LPDP Bekerja ,https://www.detik.com/edu/infografis/d-6317236/di-mana-alumni-lpdp-bekerja,detikcom,Pendidikan
Timeline Persiapan Daftar Program LPDP Mahasiswa Jangan Terburu,https://kabarbanten.pikiran-rakyat.com/pendidikan/pr-595654866/timeline-persiapan-daftar-program-lpdp-mahasiswa-jangan-terburu-buru,Kabar Banten - Kabar Banten,Pendidikan
Beasiswa S2 dan S3 dari LPDP dan Australia Awards ,https://www.kemenkumham.go.id/publikasi-2/info-internal/beasiswa-s2-dan-s3-dari-lpdp-dan-australia-awards,Kementerian Hukum dan Hak Asasi Manusia,Pendidikan
Selain LPDP Ini 4 Program Beasiswa Penuh untuk Kuliah S2,https://www.parapuan.co/read/533486239/selain-lpdp-ini-4-program-beasiswa-penuh-untuk-kuliah-s2-s3-di-inggris,Parapuan.co,Pendidikan
Sosialisasi Beasiswa LPDP Kemenkeu RI di PWNU  NU Online Jawa Barat ,https://ltnnujabar.or.id/sosialisasi-beasiswa-lpdp-kemenkeu-ri-di-pwnu/,Website resmi LTNNU Jawa Barat,Pendidikan
Kemenag Sebut Dana Abadi Pesantren Baru Bersumber dari LPDP ,https://tirto.id/kemenag-sebut-dana-abadi-pesantren-baru-bersumber-dari-lpdp-gwPw,Tirto.id,Pendidikan
Melalui LPDP Tim Peneliti Kembangkan Limbah Bulu Ayam Jadi Material Baru Ramah Lingkungan ,https://pedomanrakyat.co.id/2022/10/15/melalui-lpdp-tim-peneliti-kembangkan-limbah-bulu-ayam-jadi-material-baru-ramah-lingkungan/,Pedomanrakyat.co.id,Pendidikan
Peluang Beasiswa S2 dan S3 Berikut Informasinya ,https://www.kliklabuanbajo.id/pendidikan/pr-5425223537/peluang-beasiswa-s2-dan-s3-berikut-informasinya,Klik Labuanbajo - Klik Labuhanbajo,Pendidikan
Top 3 Tekno Berita Hari Ini Beasiswa Indonesia Maju 3 Mahasiswa S3 di Inggris ,https://tekno.tempo.co/read/1646385/top-3-tekno-berita-hari-ini-beasiswa-indonesia-maju-3-mahasiswa-s3-di-inggris,Tekno Tempo,Pendidikan
4 Polisi Pasukan Perdamaian PBB di Afrika Nomor 1 Raih Beasiswa LPDP ,https://metro.sindonews.com/read/907597/170/4-polisi-pasukan-perdamaian-pbb-di-afrika-nomor-1-raih-beasiswa-lpdp-1665277856,SINDOnews Metro,Pendidikan
HARI INI Cek Pengumuman LPDP Kemenag 2022 Hasil Seleksi Akademik Lihat Hasil Login di beasiswakemenagorid ,https://portalkudus.pikiran-rakyat.com/nasional/pr-795573712/hari-ini-cek-pengumuman-lpdp-kemenag-2022-hasil-seleksi-akademik-lihat-hasil-login-di-beasiswakemenagorid,Portal Kudus - Portal Kudus,Pendidikan
Ini Tips Lolos Beasiswa LPDP 2022 dari Penerima Beasiswa ,https://kampus.republika.co.id/posts/162718/ini-tips-lolos-beasiswa-lpdp-2022-dari-penerima-beasiswa,Republika,Pendidikan
Pesan Sri Mulyani ke Penerima Beasiswa LPDP Asal Papua PR Besar Tantangan Pengabdian ,https://bisnis.tempo.co/read/1623931/pesan-sri-mulyani-ke-penerima-beasiswa-lpdp-asal-papua-pr-besar-tantangan-pengabdian,Bisnis Tempo.co,Pendidikan
Kontroversi Pelajar yang Ingin Menetap di Luar Negeri ,https://www.kompasiana.com/clemensambrosiusmichaellinus9074/634bd072075df237563046b4/kontraversi-pelajar-yang-ingin-menetap-di-luar-negeri,Kompasiana.com - Kompasiana.com,Pendidikan
LINK Pendaftaran Beasiswa Non Gelar Kemenag Batch 1 2022 Catat Jadwal Pendaftaran dan Cara Daftarnya ,https://www.jatengnews.id/2022/10/13/link-pendaftaran-beasiswa-non-gelar-kemenag-batch-1-2022-catat-jadwal-pendaftaran-dan-cara-daftarnya/,Berita Jatengnews,Pendidikan
Cuaca Jakarta Hari Ini BMKG Waspada Hujan Petir dengan Durasi Singkat ,https://metro.tempo.co/read/1646502/cuaca-jakarta-hari-ini-bmkg-waspada-hujan-petir-dengan-durasi-singkat,Metro Tempo,Pendidikan
Indonesiagoid ,https://indonesia.go.id/kategori/pendidikan/5216/pemerintah-buka-beasiswa-lpdp-tahap-2?lang=1,Pemerintah Buka Beasiswa LPDP Tahap 2 - Portal Informasi Indonesia,Pendidikan
7 Program Beasiswa Google untuk Perempuan ,https://tekno.tempo.co/read/1646200/7-program-beasiswa-google-untuk-perempuan,Tekno Tempo,Pendidikan
Pahami LPDP Beasiswa untuk Anak Bangsa dan Cara Mendapatkannya ,https://www.cnnindonesia.com/ekonomi/20220802082800-532-829048/pahami-lpdp-beasiswa-untuk-anak-bangsa-dan-cara-mendapatkannya,CNN Indonesia,Pendidikan
Mengenal Beasiswa LPDP dan Cara Mendapatkannya ,https://finance.detik.com/berita-ekonomi-bisnis/d-6205454/mengenal-beasiswa-lpdp-dan-cara-mendapatkannya,detikFinance,Pendidikan
Beasiswa LPDP 2022 Resmi Dibuka Ini Persyaratan Lengkapnya ,https://kampus.republika.co.id/posts/58665/beasiswa-lpdp-2022-resmi-dibuka-ini-persyaratan-lengkapnya,Republika,Pendidikan
Usai Studi Mahasiswa LPDP Diminta Mengabdi Pada Negara  Kementerian Koordinator Bidang Pembangunan Manusia dan Kebudayaan ,https://www.kemenkopmk.go.id/usai-studi-mahasiswa-lpdp-diminta-mengabdi-pada-negara,Kemenko PMK,Pendidikan
Pendaftaran Beasiswa LPDP Ditutup 2 Hari Lagi Cek Lagi Syaratnya ,https://www.detik.com/edu/beasiswa/d-6213675/pendaftaran-beasiswa-lpdp-ditutup-2-hari-lagi-cek-lagi-syaratnya,detikcom,Pendidikan
Mengenal Beasiswa LPDP dan Cara Mendapatkannya ,https://money.kompas.com/read/2022/05/02/122734726/mengenal-beasiswa-lpdp-dan-cara-mendapatkannya?page=all,Kompas.com - Kompas.com,Pendidikan
Beasiswa LPDP Tahap 2 Dibuka 4 Juli Cek Syarat dan Cara Daftar ,https://www.kompas.com/edu/read/2022/06/21/093710171/beasiswa-lpdp-tahap-2-dibuka-4-juli-cek-syarat-dan-cara-daftar?page=all,Kompas.com - KOMPAS.com,Pendidikan
138 Alumni Penerima Beasiswa Tidak Pulang Ini Rencana LPDP dengan Dirjen Imigrasi ,https://bisnis.tempo.co/read/1633439/138-alumni-penerima-beasiswa-tidak-pulang-ini-rencana-lpdp-dengan-dirjen-imigrasi,Bisnis Tempo.co,Pendidikan
4 Juli Dibuka Cek Syarat Mendaftar Beasiswa LPDP Reguler 2022 Tahap 2 Ini ,https://regional.kontan.co.id/news/4-juli-dibuka-cek-syarat-mendaftar-beasiswa-lpdp-reguler-2022-tahap-2-ini,Regional Kontan,Pendidikan
Perdana ,https://www.kemenag.go.id/read/perdana-kemenag-lpdp-siapkan-10-000-kuota-beasiswa-pendidikan-profesi-guru-dl6zm,Kemenag,Pendidikan
Dibuka Ini Kuota Penerima Beasiswa LPDP Pada 2022 ,https://kabar24.bisnis.com/read/20220610/15/1542301/dibuka-ini-kuota-penerima-beasiswa-lpdp-pada-2022,Bisnis.com,Pendidikan
Sri Mulyani Sebut Ada 17621 Penerima Beasiswa LPDP 2022 ,https://finance.detik.com/berita-ekonomi-bisnis/d-6230013/sri-mulyani-sebut-ada-17621-penerima-beasiswa-lpdp-2022,detikFinance,Pendidikan
RUU Sisdiknas dan Riuh Rendah Kesejahteraan Guru ,https://kapol.id/ruu-sisdiknas-dan-riuh-rendah-kesejahteraan-guru/,KAPOL.ID,Pendidikan
4 Program Beasiswa Sarjana LPDP,https://www.nu.or.id/nasional/4-program-beasiswa-sarjana-lpdp-kemenag-tahun-2022-cek-persyaratannya-zrha2,Islam NU,Pendidikan
10 Poin Penting dalam Pendaftaran Beasiswa LPDP Reguler Simak Baik,https://www.detik.com/edu/beasiswa/d-6188813/10-poin-penting-dalam-pendaftaran-beasiswa-lpdp-reguler-simak-baik-baik,detikcom,Pendidikan
Pendaftaran Beasiswa LPDP Segera Dibuka Ini Jadwal Lengkapnya ,https://kampus.republika.co.id/posts/52999/pendaftaran-beasiswa-lpdp-segera-dibuka-ini-jadwal-lengkapnya,Republika,Pendidikan
Wajib Tahu 15 Istilah dalam Seleksi Beasiswa LPDP Mulai dari Awardee hingga LoA ,https://regional.kompas.com/read/2022/03/10/174818678/wajib-tahu-15-istilah-dalam-seleksi-beasiswa-lpdp-mulai-dari-awardee-hingga?page=all,Kompas.com - Kompas.com,Pendidikan
Ada Beasiswa LPDP Program Microdential untuk Guru PAUD Kuliah Daring di Monash University ,https://kampus.republika.co.id/posts/167549/ada-beasiswa-lpdp-program-microdential-untuk-guru-paud-kuliah-daring-di-monash-university,Republika,Pendidikan
LPDP Buka Lowongan Pewawancara Beasiswa Ini Syaratnya ,https://kampus.republika.co.id/posts/67438/lpdp-buka-lowongan-pewawancara-beasiswa-ini-syaratnya,Republika,Pendidikan
Beasiswa LPDP 2022 Tahap I Apa Saja yang Didapat Penerima Beasiswa ,https://www.kompas.com/tren/read/2022/02/28/200000865/beasiswa-lpdp-2022-tahap-i-apa-saja-yang-didapat-penerima-beasiswa-?page=all,Kompas.com - KOMPAS.com,Pendidikan
Respons Antusiasme Pendaftar Beasiswa LPDP Buka Layanan Tatap Muka ,https://kampus.republika.co.id/posts/71804/respons-antusiasme-pendaftar-beasiswa-lpdp-buka-layanan-tatap-muka,Republika,Pendidikan
Ini Aturan Beasiswa LPDP untuk PNS TNI dan Polri ,https://kampus.republika.co.id/posts/59686/ini-aturan-beasiswa-lpdp-untuk-pns-tni-dan-polri,Republika,Pendidikan
P3M2 Sosialisasi Beasiswa Santri dan Kader Ulama LPDP ,https://www.iainpare.ac.id/p3m2-sosialisasi-beasiswa-santri-dan-kader-ulama-lpdp/,IAIN PAREPARE,Pendidikan
25 Kampus Top Tujuan Beasiswa Perguruan Tinggi Utama Dunia LPDP ,https://kampus.republika.co.id/posts/79351/25-kampus-top-tujuan-beasiswa-perguruan-tinggi-utama-dunia-lpdp,Republika,Pendidikan
Warga 79 Kabupaten Ini Mendapat Alokasi Beasiswa Daerah Afirmasi LPDP ,https://kampus.republika.co.id/posts/74189/warga-79-kabupaten-ini-mendapat-alokasi-beasiswa-daerah-afirmasi-lpdp,Republika,Pendidikan
Beasiswa LPDP Mengapa proses seleksi bias agama dan terjadi berulang kali ,https://www.bbc.com/indonesia/indonesia-61291580,BBC News Indonesia,Pendidikan
Lulus Seleksi Beasiswa LPDP Ini Hal yang Harus Dilakukan Sebelum Mulai Kuliah ,https://www.detik.com/edu/beasiswa/d-6174042/lulus-seleksi-beasiswa-lpdp-ini-hal-yang-harus-dilakukan-sebelum-mulai-kuliah,detikcom,Pendidikan
Audiensi Direktur Beasiswa LPDP ,https://www.menpan.go.id/site/berita-foto/audiensi-direktur-beasiswa-lpdp,Kementerian Pendayagunaan Aparatur Negara dan Reformasi Birokrasi,Pendidikan
Gempa Magnitudo 51 Guncang Maluku dan Sulawesi Utara ,https://tekno.tempo.co/read/1646376/gempa-magnitudo-51-guncangmaluku-dan-sulawesi-utara,Tekno Tempo,Pendidikan
Beasiswa LPDP 2022 akan Dibuka Apa Saja Persyaratannya ,https://www.detik.com/edu/beasiswa/d-5899823/beasiswa-lpdp-2022-akan-dibuka-apa-saja-persyaratannya,detikcom,Pendidikan
Rektor IPB Bikin Skema Belajar Fleksibel Selama Cuaca Ekstrem ,https://tekno.tempo.co/read/1646033/rektor-ipb-bikin-skema-belajar-fleksibel-selama-cuaca-ekstrem,Tekno Tempo,Pendidikan
Pendaftaran Beasiswa LPDP Reguler 2022 Sudah Dibuka Ini Syarat dan Cara Daftarnya ,https://regional.kontan.co.id/news/pendaftaran-beasiswa-lpdp-reguler-2022-sudah-dibuka-ini-syarat-dan-cara-daftarnya?page=all,Regional Kontan,Pendidikan
Angkatan 181 Beasiswa LPDP Gelar Pemberdayaan Masyarakat Lokal Kepulauan Seribu ,https://www.kompas.com/edu/read/2022/05/24/212453471/angkatan-181-beasiswa-lpdp-gelar-pemberdayaan-masyarakat-lokal-kepulauan?page=all,Kompas.com - KOMPAS.com,Pendidikan
Indonesiagoid ,https://indonesia.go.id/kategori/editorial/4284/ayo-daftar-lpdp-sediakan-29-872-beasiswa?lang=1,"Ayo Daftar, LPDP Sediakan 29.872 Beasiswa - Portal Informasi Indonesia",Pendidikan
Cara dan Syarat Pendaftaran Beasiswa LPDP 20222023 ,https://kabar24.bisnis.com/read/20220127/243/1494202/cara-dan-syarat-pendaftaran-beasiswa-lpdp-20222023,Bisnis.com,Pendidikan
Kebijakan LPDP 2021 Vs 2022 Apa Saja yang Berubah ,https://www.detik.com/edu/beasiswa/d-6040948/kebijakan-lpdp-2021-vs-2022-apa-saja-yang-berubah,detikcom,Pendidikan
Mau Lolos Beasiswa LPDP Simak 3 Tips Penting Ini ,https://www.detik.com/edu/beasiswa/d-5919880/mau-lolos-beasiswa-lpdp-simak-3-tips-penting-ini,detikcom,Pendidikan
Syarat Beasiswa LPDP Reguler 2022 dari Batas Usia hingga Skor TOEFL ,https://www.detik.com/edu/beasiswa/d-5982819/syarat-beasiswa-lpdp-reguler-2022-dari-batas-usia-hingga-skor-toefl,detikcom,Pendidikan
LPDP Buka Beasiswa S2 di Bidang Metalurgi dan Sains Material di Cina Mau  ,https://kampus.republika.co.id/posts/144341/lpdp-buka-beasiswa-s2-di-bidang-metalurgi-dan-sains-material-di-cina-mau,Republika,Pendidikan
Kerjasama Kemenag dan LPDP 2000 Guru Dapat Beasiswa S1 PJJ PAI ,https://kampus.republika.co.id/posts/165652/kerjasama-kemenag-dan-lpdp-2-000-guru-dapat-beasiswa-s1-pjj-pai,Republika,Pendidikan
Beasiswa Prasejahtera LPDP Terbuka Bagi Penerima Bansos ,https://kampus.republika.co.id/posts/80374/beasiswa-prasejahtera-lpdp-terbuka-bagi-penerima-bansos,Republika,Pendidikan
LPDP Beri Peluang Karier untuk Para Alumni Ini Sederet Posisi dan Syaratnya ,https://www.detik.com/edu/edutainment/d-6229963/lpdp-beri-peluang-karier-untuk-para-alumni-ini-sederet-posisi-dan-syaratnya,detikcom,Pendidikan
Dana Abadi Pendidikan Kelolaan LPDP Diproyeksi Tembus Rp120 Triliun Tahun Ini ,https://ekonomi.bisnis.com/read/20220610/9/1542222/dana-abadi-pendidikan-kelolaan-lpdp-diproyeksi-tembus-rp120-triliun-tahun-ini,Bisnis.com,Pendidikan
5 Strategi untuk Tingkatkan Peluang Lolos Seleksi Beasiswa LPDP ,https://edukasi.kompas.com/read/2022/07/19/104300771/5-strategi-untuk-tingkatkan-peluang-lolos-seleksi-beasiswa-lpdp?page=all,Kompas.com - Edukasi Kompas.com,Pendidikan
Lewat Beasiswa OKP,https://www.kompas.com/edu/read/2022/07/23/113715071/lewat-beasiswa-okp-lpdp-15-pemuda-indonesia-siap-lanjut-s2-ke-belanda?page=all,Kompas.com - KOMPAS.com,Pendidikan
Viral LPDP Disebut Dikuasai Kaum Tarbiyah Dirut Membantah ,https://news.detik.com/berita/d-5949368/viral-lpdp-disebut-dikuasai-kaum-tarbiyah-dirut-membantah,detikNews,Pendidikan
Awardee LPDP Sediakan atau Disediakan Lapangan Kerja Ini Tanggapannya ,https://www.detik.com/edu/beasiswa/d-5979681/awardee-lpdp-sediakan-atau-disediakan-lapangan-kerja-ini-tanggapannya,detikcom,Pendidikan
Beasiswa LPDP 2022 untuk Perguruan Tinggi Dalam Negeri Ini Daftarnya ,https://www.detik.com/edu/beasiswa/d-5967746/beasiswa-lpdp-2022-untuk-perguruan-tinggi-dalam-negeri-ini-daftarnya,detikcom,Pendidikan
Siap,https://calakan.republika.co.id/posts/152756/siap-siap-daftar-lpdp-tahap-2-2022,calakan.republika.co.id,Pendidikan
Tips Lolos LPDP Kuliah S2 Dalam Negeri Tahu Tujuan Siapkan Berkas dan Harus Jujur ,https://regional.kompas.com/read/2022/03/09/185739478/tips-lolos-lpdp-kuliah-s2-dalam-negeri-tahu-tujuan-siapkan-berkas-dan-harus?page=all,Kompas.com - Kompas.com,Pendidikan
Beri Privilese LPDP Ternyata Punya Beasiswa Bagi Disabilitas ,https://www.cnbcindonesia.com/news/20220731105928-4-359912/beri-privilese-lpdp-ternyata-punya-beasiswa-bagi-disabilitas,CNBC Indonesia,Pendidikan
Erdogan Diejek Tikus Got sampai Pelajar RI di Inggris Ikut Kena Krisis ,https://www.cnnindonesia.com/internasional/20220929061558-134-853993/erdogan-diejek-tikus-got-sampai-pelajar-ri-di-inggris-ikut-kena-krisis,CNN Indonesia,Pendidikan
Dibuka Besok Ini Jadwal dan Panduan Pendaftaran LPDP 2022 ,https://www.kompas.com/tren/read/2022/02/24/133000965/dibuka-besok-ini-jadwal-dan-panduan-pendaftaran-lpdp-2022?page=all,Kompas.com - KOMPAS.com,Pendidikan
Besok 252 Dibuka Ini Jadwal  Syarat Pendaftaran Beasiswa S2 LPDP ,https://nasional.kontan.co.id/news/besok-252-dibuka-ini-jadwal-syarat-pendaftaran-beasiswa-s2-lpdp,Internasional Kontan,Pendidikan
Kemdikbudristek dan LPDP Luncurkan Beasiswa untuk Guru Pendidikan Khusus ,https://kampus.republika.co.id/posts/170061/kemdikbudristek-dan-lpdp-luncurkan-beasiswa-untuk-guru-pendidikan-khusus,Republika,Pendidikan
Dibuka Februari Ini Syarat Pendaftaran Beasiswa LPDP 2022 ,https://kabar24.bisnis.com/read/20220112/15/1488111/dibuka-februari-ini-syarat-pendaftaran-beasiswa-lpdp-2022,Bisnis.com,Pendidikan
Syarat Khusus Beasiswa LPDP Putra,https://kampus.republika.co.id/posts/67320/syarat-khusus-beasiswa-lpdp-putra-putri-papua-program-doktor-bisa-sampaiumur-50-tahun,Republika,Pendidikan
Resmi Dibuka Simak Syarat dan Jadwal Pendaftaran LPDP 2022 ,https://www.pikiran-rakyat.com/pendidikan/pr-013877288/resmi-dibuka-simak-syarat-dan-jadwal-pendaftaran-lpdp-2022,Pikiran-Rakyat.com - Pikiran Rakyat,Pendidikan
Sri Mulyani ke Calon Penerima LPDP Anda Harus Kembali ,https://www.cnnindonesia.com/ekonomi/20220315203213-532-771702/sri-mulyani-ke-calon-penerima-lpdp-anda-harus-kembali,CNN Indonesia,Pendidikan
Aksi Penerima Beasiswa LPDP untuk Lingkungan ,https://www.republika.co.id/berita/rh1io3478/aksi-penerima-beasiswa-lpdp-untuk-lingkungan,Republika Online,Pendidikan
Seleksi Beasiswa LPDP Tahap 2 Dibuka Pekan Depan Berikut Syarat dan Cara Daftarnya ,https://www.kompas.tv/article/303080/seleksi-beasiswa-lpdp-tahap-2-dibuka-pekan-depan-berikut-syarat-dan-cara-daftarnya,Kompas TV,Pendidikan
Ingin Daftar Beasiswa LPDP Jangan Lupa Ikuti Webinarnya Pagi Ini ,https://kampus.republika.co.id/posts/58309/ingin-daftar-beasiswa-lpdp-jangan-lupa-ikuti-webinarnya-pagi-ini,Republika,Pendidikan
Beasiswa S2 Reguler Dalam Negeri dari Kemenag dan LPDP Ada Waktu 3 Hari Lagi untuk Daftar ,https://www.nu.or.id/nasional/beasiswa-s2-reguler-dalam-negeri-dari-kemenag-dan-lpdp-ada-waktu-3-hari-lagi-untuk-daftar-4fzFN,Islam NU,Pendidikan
3 Kesalahan saat Wawancara LPDP Jangan Lakukan Jika Mau Lolos ,https://www.detik.com/edu/beasiswa/d-6155948/3-kesalahan-saat-wawancara-lpdp-jangan-lakukan-jika-mau-lolos,detikcom,Pendidikan
LPDP Buka Program Beasiswa 4 Juli 2022 Ini Syarat untuk PNS yang Ingin Mendaftar  merdeka ,https://www.merdeka.com/uang/lpdp-buka-program-beasiswa-4-juli-2022-ini-syarat-untuk-pns-yang-ingin-mendaftar.html,Merdeka.com,Pendidikan
Simak Kategori Beasiswa LPDP Tahap II  Profesi Online ,https://profesi-unm.com/2022/05/07/simak-kategori-beasiswa-lpdp-tahap-ii/,Profesi UNM,Pendidikan
Beasiswa LPDP PNSTNIPolri 2022 Hanya untuk Kelas Reguler Ini Syaratnya ,https://www.detik.com/edu/beasiswa/d-5969289/beasiswa-lpdp-pnstnipolri-2022-hanya-untuk-kelas-reguler-ini-syaratnya,detikcom,Pendidikan
Pemerintah Buka Beasiswa LPDP Tahun 2022 ,https://www.menpan.go.id/site/berita-terkini/berita-daerah/pemerintah-buka-beasiswa-lpdp-tahun-2022,Kementerian Pendayagunaan Aparatur Negara dan Reformasi Birokrasi,Pendidikan
Sebentar Lagi DIbuka Ini Syarat Daftar Beasiswa Reguler LPDP Tahap 2 Tahun 2022 ,https://regional.kontan.co.id/news/sebentar-lagi-dibuka-ini-syarat-daftar-beasiswa-reguler-lpdp-tahap-2-tahun-2022,Regional Kontan,Pendidikan
Beasiswa LPDP Kewirausahaan 2022 Cek Syarat dan Daftar PT Tujuannya ,https://www.detik.com/edu/beasiswa/d-5975400/beasiswa-lpdp-kewirausahaan-2022-cek-syarat-dan-daftar-pt-tujuannya,detikcom,Pendidikan
Simak Proses Seleksi dan Cara Pendaftaran Beasiswa LPDP 2022 ,https://kabar24.bisnis.com/read/20220127/79/1494089/simak-proses-seleksi-dan-cara-pendaftaran-beasiswa-lpdp-2022,Bisnis.com,Pendidikan
INFOGRAFIS Data Penerima dan Anggaran LPDP ,https://www.cnnindonesia.com/ekonomi/20220803100322-535-829609/infografis-data-penerima-dan-anggaran-lpdp,CNN Indonesia,Pendidikan
